name,link_path,functional_areas,,
HBCU Faculty Development Network,http://www.hbcufdn.org/,"Policy, Government, Other Organization",,
University Council for Educational Administration,http://www.ucea.org,"Policy, Government, Other Organization",,
National Association for Colleges and University Business Officers (NACUBO),http://www.nacubo.org/,"Policy, Government, Other Organization",,
Association of American Colleges and Universities (AAC&U),http://www.aacu.org/,"Policy, Government, Other Organization",,
Council for Advancement and Support of Education (CASE),http://www.case.org/,"Policy, Government, Other Organization",,
Consortium on Financing Higher Education (COFHE),http://web.mit.edu/cofhe/,"Policy, Government, Other Organization",,
National Association of Independent Colleges and Universities (NAICU),http://www.naicu.edu/,"Policy, Government, Other Organization",,
Association of Governing Boards (AGB),http://agb.org/,"Policy, Government, Other Organization",,
The Global Community for Academic Advising (NACADA),http://www.nacada.ksu.edu/,Student Affairs,,
American Educational Research Association (AERA),http://www.aera.net/,Student Affairs,,
EDUCAUSE,http://www.educause.edu/,"policy, Government, Other Organization",,
Carnegie Foundation for the Advancement of Teaching,http://www.carnegiefoundation.org/,"Policy, Government, Other Organization",,
ACPA (College Student Educators International),http://www.myacpa.org/,Student Affairs,,
Commision for Academic Support in Higher Education (CASHE),http://www.myacpa.org/commashe,academic affairs ,,
NASPA: Student Affairs Administrators in Higher Education (NASPA),http://www.naspa.org/,student Affairs,,
The National Center for Public Policy and Higher Education,http://highereducation.org/,"policy, Government, Other Organization",,
ACE The American Council on Education,http://www.acenet.edu/Pages/default.aspx,"policy, Government, Other Organization",,
National Association for Graduate Enrollment Management (NAGAP),http://www.nagap.org/about-nagap,enrollment management,,
National Association for College Admission Counseling (NACAC),http://www.nacacnet.org/Pages/default.aspx,enrollment management,,
American Association of Collegiate Registrars and Admissions (AACRAO),http://www.aacrao.org/,enrollment management,,
National Association of Colleges and Employers (NACE),http://www.naceweb.org/,"policy, Government, Other Organization",,
National Association of Student Affairs Professionals (NASAP),http://www.nasap.net/,student Affairs,,
National Association of Collegiate Directors of Athletics (NACDA),http://www.nacda.com/,"policy, Government, Other Organization",,
National Association of Collegiate Women (NACWAA),https://www.nacwaa.org/,Student Affairs,,
National Career Development Association (NCDA),http://www.ncda.org/aws/NCDA/pt/sp/home_page,Student Affairs,,
Institute of International Education,http://www.iie.org/,Academic Affairs,,
NAFSA: Association of International Educators (NAFSA),http://www.nafsa.org/,Academic Affairs,,
The Forum on Education Abroad,https://forumea.org/,Academic Affairs,,
International Educators of Illinois (IEI),http://ieillinois.org/iei/,Academic Affairs,,
National Association of College and University Residence Halls,http://www.nacurh.org/,Student Affairs,,
American Association of Community Colleges (AACC),http://www.aacc.nche.edu/Pages/default.aspx,"Policy, Government, Other Organizations",,
American Association of University Women (AAUW),http://www.aauw.org/,Student Affairs,,
American Counseling Association (ACA),https://www.counseling.org/,Student Affairs,,
Association of College Unions (ACUI),http://www.acui.org/,"Policy, Government, Other Organizations",,
Association of College and University Housing Officers--International (ACUHO),http://www.acuho-i.org/home/portalid/0,Student Affairs,,
American College Counseling Association (ACCA),http://www.collegecounseling.org/,Student Affairs,,
American College Health Association (ACHA),http://www.acha.org/,Student Affairs,,
Association of Fraternity Advisors (AFA),http://www.afa1976.org/,Student Affairs,,
Association of Higher Education and Disability (AHEAD),https://www.ahead.org/,"Policy, Government, Other Organizations",,
Association of Public and Land-grant Universities (APLU),http://www.aplu.org/,"Policy, Government, Other Organizations",,
Association for Student Conduct Administration (ASCA),http://www.theasca.org/,Student Affairs,,
Association for the Study of Higher Education (ASHE),http://www.ashe.ws/,Academic Affairs,,
Association for University and College Counseling Center Directors (AUCCCD),http://www.aucccd.org/,Student Affairs,,
Jesuit Association of Student Personnel Administrators (JASPA),http://jaspa.orgsync.com/,Student Affairs,,
National Association of Campus Activities (NACA),https://www.naca.org/Pages/default.aspx,Student Affairs,,
National Academic Advising Association (NACADA),https://www.nacada.ksu.edu/,Academic Affairs,,
National Association of Student Financial Aid Administrators (NASFAA),https://www.nasfaa.org/,Student Affairs,,
National Intramural-Recreational Sports Association (NIRSA),http://nirsa.net/nirsa/,Student Affairs,,
National Orientation Directors Association (NODA),http://www.nodaweb.org/,Student Affairs,,